lyrics,year,lable,name
"There was a lonesome cowboy, who rode his horse all day
At night he slept in the moonlight, till he heard that midnight
Train...

And then that lonesome cowboy, looked up at the stars in the sky
""I will leave my land and my horses, on that midnight train I will
Ride

To the city, far across the plains
To that city, on that midnight train, here it comes
Choo choo choo... on that midnight train""

And then that lonesome cowboy, stepped into a bar
A pretty girl slid over nice and easy, ""Boy your money won't go far.""

She took him outside to an alley, he got dragged into a fight
And a bullet sent him dying, and he cursed that moonless night

In that city, far across the plains
In that city, he could hear that midnight train, down the line;
Choo choo choo... he could hear that midnight train

And now that lonesome cowboy is lain beneath the clay
His horses they're still waiting, for he is gone away;

Now if you think the grass is greener on the far side of the hill
All you cowboys, take it easy, there's no grass there at all

In that city, far across the plains
In that city, you'd better miss that midnight train, here it comes
Choo choo choo... you'd better miss that midnight train
Choo choo choo... that train is coming for you",1975,0,Chris De Burgh
"Where your love is, put your heart, guard these moments well
Where your dreams are, put your hopes, you know they will not fail you
When the sun rises in the morning, you will wake up and find her yawning
When the wind blows strong and cold, she'll be with you until you grow old
Where your love is, put your heart, oh what would you do if your dreams came true?

I would build a lovely house with satin green shutters, it would be lovely
The most lovely house in the world...
And I would sing a lovely song with you in my mind, and you in my eyes
The most lovely song in the world...
I would write it down on the wall, just for you, just for you;
And I would hold you in my arms for the rest of my days

When you're sad and feeling low, you're on your own with nowhere to go
Make believe that she is gone, play your guitar and write a song for her
Write down the words about how you cried when you woke up weeping
'Cos you thought that she had died, and you heard her breathing
Through your pain and you held her close and cried all over again;
Where your love is, put your heart, oh what would you do if your dreams came true?

And inside my lovely house with satin green shutters, there would be children
The most lovely children in the world...
And even when skies are grey, we would be happy, for we have love
The most lovely love in the world;
I would write it down on the wind, just for you, just for you;
And I would hold you in my arms for the rest of my days",1975,0,Chris De Burgh
"Flying, I thought I'd never learn that flying
I thought I'd spend my whole life trying
For flying is that ancient art of keeping one foot on the ground...

Lying, I thought I'd never keep from lying
I thought I'd lose it all by sighing
For lying is that ancient art of hiding words that will never be found

Crying, I thought I'd never stop that crying
I thought I'd always dream of dying
For crying is that ancient art of weeping rivers into the ground

Oh dying, I thought I'd never see that dying
I thought I'd spend my whole life flying
For dying is that ancient art of keeping one world turning round

Sighing, I thought I'd never keep from sighing
I thought I'd always be there crying
For sighing is that ancient art of breathing sadness all around

And trying, I thought I'd spend my seasons trying
I thought I could stop myself from lying
For trying is that ancient art of proving that the world is round

Oh flying, oh oh
Lying, oh oh
Crying, oh oh
Sighing, oh oh
Trying, oh oh
And dying, oh oh
For dying is that ancient art of growing flowers in the ground
Yes it is...",1975,0,Chris De Burgh
"Well, it's after midnight and the stars are shining bright
And a big fat moon is dancing on the sea, and I'm thinking, oh my...
And that old man in the sky he's looking me right in the eye
And he's wondering why, and he's saying ""Little singer
Why aren't you sleeping, why aren't you sleeping?""
Oh, the day is hanging heavy on my eyes, I guess the time
Has come to say goodnight...

And may your dreams take you travelling all night long
With an angel by your side when the wind blows strong
Oh stay away from that city, that sad and lonely place
I will lead you to the river, here's the door
And the key is turning round
Close the shutters, do not cry, there's a new moon in the sky;
Oh hold on to your love, until your time has come to say... goodnight",1975,0,Chris De Burgh
"[Verse 1]
It was a long and dark December
From the rooftops I remember
There was snow, white snow
Clearly I remember
From the windows they were watching
While we froze down below
When the future's architectured
By a carnival of idiots on show
You'd better lie low

[Refrain]
If you love me, won't you let me know?

[Verse 2]
Was a long and dark December
When the banks became cathedrals
And a fox became God
Priests clutched onto bibles
Hollowed out to fit their rifles
And a cross was held aloft
Bury me in armor
When I'm dead and hit the ground
My nerves are poles that unfroze

[Refrain]
And if you love me, won't you let me know?

[Guitar Solo]

[Verse 3]
I don't want to be a soldier
Who the captain of some sinking ship
Would stow, far below

[Refrain]
So if you love me, why'd you let me go?

[Outro]
I took my love down to Violet Hill
There we sat in snow
All that time she was silent still
So if you love me, won't you let me know?
If you love me, won't you let me know?",2008,1,Coldplay
"[Verse 1]
As far as I can see
All time and circuitry is wrong

As far as poetry
Sit down and sing to me a song

[Chorus]
'Cause all I want in this world
All I want in this world
Is for you to come home

A spell a rebel yell
A spell

[Verse 2]
Soldier come home to me
You've been away from me so long

[Chorus]
And all I want in this world
All I want and deserve
Is for you to come home

[Outro x 2]
A spell a rebel yell
A spell a rebel yell
A spell a rebel yell
A spell a rebel yell

Oh, oh oh oh",2008,1,Coldplay
"[Verse 1]
Just because I'm losing
Doesn't mean I'm lost
Doesn't mean I'll stop
Doesn't mean I'm across
Just because I'm hurting
Doesn't mean I'm hurt
Doesn't mean I didn't get what I deserve
No better or no worse

[Chorus]
I just got lost
Every river that I've tried to cross
Every door I ever tried was locked
Oh, and I'm just waiting 'til the shine wears off

[Verse 2]
You might be a big fish
In a little pond
Doesn't mean you've won, 'cause along may come
A bigger one

[Chorus]
And you'll be lost
Every river that you try to cross
Every gun you ever held went off
Oh, and I'm just waiting 'til the firing stopped
Oh, and I'm just waiting 'til the shine wears off

[Instrumental Break]

[Outro]
Oh, and I'm just waiting 'til the shine wears off
Oh, and I'm just waiting 'til the shine wears off",2008,1,Coldplay
"[Verse 1]
Is our secret safe tonight?
And are we out of sight?
Or will our world come tumbling down?
Will they find our hiding place?
Is this our last embrace?
Or will the walls start caving in?

[Hook]
It could be wrong, could be wrong, but it should have been right
It could be wrong, could be wrong, to let our hearts ignite
It could be wrong, could be wrong, are we digging a hole?
It could be wrong, could be wrong, this is out of control
It could be wrong, could be wrong, it can never last
It could be wrong, could be wrong, must erase it fast
It could be wrong, could be wrong, but it could have been right
It could be wrong, could be....

[Chorus]
Love is our resistance
They'll keep us apart and they won't stop breaking us down
Hold me
Our lips must always be sealed

[Verse 2]
If we live a life in fear
I'll wait a thousand years
Just to see you smile again
Kill your prayers for love and peace
You'll wake the thought police
We can't hide the truth inside

[Hook]
It could be wrong, could be wrong, but it should have been right
It could be wrong, could be wrong, to let our hearts ignite
It could be wrong, could be wrong, are we digging a hole?
It could be wrong, could be wrong, this is out of control
It could be wrong, could be wrong, it can never last
It could be wrong, could be wrong, must erase it fast
It could be wrong, could be wrong, but it could have been right
It could be wrong, could be....

[Chorus]
Love is our resistance
They'll keep us apart and they won't stop breaking us down
Hold me
Our lips must always be sealed

[Outro]
The night has reached its end
We can't pretend
We must run
We must run
It's time to run
Take us away from here
Protect us from further harm
Resistance",2010,1,Muse
"[Verse 1]
Is our secret safe tonight?
And are we out of sight?
Or will our world come tumbling down?
Will they find our hiding place?
Is this our last embrace?
Or will the walls start caving in?

[Chorus]
Love is our resistance
They'll keep us apart and they won't stop breaking us down
Hold me
Our lips must always be sealed

[Verse 2]
If we live a life in fear
I'll wait a thousand years
Just to see you smile again
Kill your prayers for love and peace
You'll wake the thought police
We can't hide the truth inside",2010,1,Muse
"[Verse 1]
It breaks my heart
To leave you far behind
It breaks me up
To leave so suddenly
Knowing we might never
Meet again
It hurts so much
To lose another friend
I could hope you're just as sad
To see me go

[Verse 2]
But I'd hate to be the cause
Of grief to someone I like so
Knowing we might never
Meet again
It hurts so much
To lose another friend

[Outro]
It breaks my heart
It breaks my heart
It breaks my heart
It breaks my heart
It breaks my heart
It breaks my heart to leave you far behind
To leave",2010,1,Muse
"[Pre-Chorus]
When you were young, and your heart was an open book
You used to say, ""Live and let live""
(You know you did, you know you did, you know you did)
But if this ever-changing world in which we live in
Makes you give in and cry

[Chorus]
Say, ""Live and let die""
Live and let die

[Post-Chorus Solo]

[Verse]
What does it matter to ya?
When you got a job to do
You got to do it well
You got to give the other fella hell

[Guitar Solo]

[Pre-Chorus]
You used to say, ""Live and let live""
(You know you did, you know you did, you know you did)
But if this ever-changing world in which we live in
Makes you give in and cry

[Chorus]
Say, ""Live and let die""
Live and let die

[Post-Chorus Solo]",1998,0,Guns N’ Roses
"[Intro]
Rollin'
One, two, three, one, two, three
Two, three, one and

[Verse 1]
I tried so hard just to get through to you
But your head's so far from the realness of truth
Was it just a come on in the dark, was it meant to last long?
I think you've worn your welcome, honey
I'll just see you along as I sing you this song

[Bridge]
One, two, three, one

[Verse 2]
Time can pass slowly and things always change
Your days been numbered and I've read your last page
You was just a temporary lover, honey, you ain't the first
Lots of others came before you, woman
Said, but you been the worst, said, you been the worst

[Bridge]
Two, three and

[Verse 3]
So, goodbye to you, girl, so long, farewell
I can't hear you crying, your jivin's been hell
So, look for me walking down your street at night
I'll be in with another, deep down inside
Deep down inside

[Duff]:
""To the bar!""

[Slash]:
""That was a take!""",1998,0,Guns N’ Roses
"[Instrumental Intro]

[Verse 1]
When I look into your eyes
I can see a love restrained
But, darlin', when I hold you
Don't you know I feel the same? Yeah...

[Chorus]
'Cause nothing lasts forever
And we both know hearts can change
And it's hard to hold a candle
In the cold November rain

[Verse 2]
We've been through this such a long, long time
Just tryna kill the pain, ooh yeah
But lovers always come and lovers always go
And no one's really sure who's lettin' go today, walkin' away
If we could take the time to lay it on the line
I could rest my head, just knowin' that you were mine, all mine

[Chorus]
So, if you want to love me
Then, darlin', don't refrain
Or I'll just end up walkin'
In the cold November rain

[Refrain]
Do you need some time on your own?
Do you need some time all alone?
Ooh, everybody needs some time on their own
Ooh, don't you know you need some time all alone?

[Bridge]
I know it's hard to keep an open heart
When even friends seem out to harm you
But if you could heal a broken heart
Wouldn't time be out to charm you, woah-woah

[Guitar Solo 1]

[Refrain]
Sometimes, I need some time on my own
Sometimes, I need some time all alone
Ooh, everybody needs some time on their own
Ooh, don't you know you need some time all alone?

[Guitar Solo 2]

[Verse 3]
And when your fears subside
And shadows still remain, ooh yeah
I know that you can love me
When there's no one left to blame

[Chorus]
So, never mind the darkness
We still can find a way
'Cause nothin' lasts forever
Even cold November rain

[Guitar Solo 3]

[Outro]
Don't ya think that you need somebody?
Don't ya think that you need someone?
Everybody needs somebody
You're not the only one, you're not the only one
Don't ya think that you need somebody?
Don't ya think that you need someone?
Everybody needs somebody
You're not the only one, you're not the only one
Don't ya think that you need somebody?
Don't ya think that you need someone?
Everybody needs somebody
You're not the only one, you're not the only one
Don't ya think that you need somebody?
Don't ya think that you need someone?
Everybody needs somebody",1998,0,Guns N’ Roses
"[Child's voice]
No I won't

[Verse 1: Axl Rose]
You know you're all alone, your friends, they aren't at home
Everybody's gone to the garden
As you look into the trees, you can look, but you don't see
Flowers seem to tease you at the garden
Everybody's there, but you don't seem to care
What's it with you man, and this garden? Yeah

[Chorus: Alice Cooper]
Turned into my worst phobia
A crazy man's utopia
If you're lost, no one can show ya
But it sure was glad to know ya
Only poor boys take a chance
On the garden's song and dance
Feel her flowers, as they wrap around
But only smart boys do without

[Guitar Solo]

[Verse 2: Axl Rose]
You can find it all inside, no need to wrestle with your pride
No, you ain't losing your mind, you're just in the garden
They can lead you to yourself or you can throw it on the shelf
But you know you can look inside for the garden

[Chorus: Alice Cooper]
I wasn't really scared
Lost my virginity there
To a gypsy with blond hair
But now no one seems to care
Like a mouse inside a maze
Wandering 'round for daze
With a smile upon my face
I never want to leave this place
Only poor boys take a chance
On this garden song and dance
Feel her flowers, as they wrap around
But only smart boys do without
Turned into my worst phobia
It's a crazy man's utopia
If you're lost no one can show you
But it sure was glad to know you

[Outro: Alice Cooper]
Bye-bye, so long, bye-bye
It's glad to know you
Bye-bye
Bye-bye
Aw, so long",1998,0,Guns N’ Roses
"[Intro]
Sick of this life, not that you'd care
I'm not the only one with whom, these feelings, I share
Nobody understands quite why we're here
We're searching for answers that never appear
Maybe if I looked real hard, I'd, I'd see you trying, too
To understand this life that we're all going through
""Then when she said she was going to, like, wreck my car
I didn't know what to do""

[Chorus]
Oh, sometimes, I feel like I'm beating a dead horse
And I don't know why you'd be bringing me down
I'd like to think that our love's worth a tad more
It may sound funny, but you'd think, by now, I'd be smiling
I guess some things never change
Oh, never change

[Verse]
I met an old cowboy, I saw the look in his eyes
Something tells me he's been here before 'cause experience makes you wise
I was only a small child when the thought first came to me
That I'm a son of a gun and the gun of a son that brought back the devil in me

[Chorus]
Oh, but sometimes, I feel like I'm beating a dead horse
I don't know why you'd be bringing me down
I'd like to think that our love's worth a tad more
It may sound funny, but you'd think, by now, I'd be smiling
Yeah, I guess some things never change
Ooh, never change

[Bridge]
I ain't quite what you'd call an old soul
Still, wet behind the years
I've been around this track a couple of times
But now the dust is starting to clear, oh, yeah

[Guitar Solo]

[Chorus]
Sometimes, I feel like I'm beating a dead horse
I don't know why you'd be bringing me down
I'd like to think that our love's worth a tad more
It may sound funny, but you'd think, by now, I'd be smiling
Ooh, yeah, I'd be smiling
No way I'd be smiling
Ooh, smiling

[Outro]
Sick of this life, not that you'd care
I'm not the only one with whom, these feelings, I share",1998,0,Guns N’ Roses
"[Spoken Intro: Strother Martin ]
What we've got here is failure to communicate
Some men, you just can't reach
So, you get what we had here, last week
Which is the way he wants it
Well, he gets it
*Whistling*
And I don't like it any more than you men

[Intro]
Look at your young men fighting
Look at your women crying
Look at your young men dying
The way they've always done before
Look at the hate we're breeding
Look at the fear we're feeding
Look at the lives we're leading
The way we've always done before

[Verse 1]
My hands are tied
The billions shift from side to side
An' the wars go on with brainwashed pride
For the love of God and our human rights
An' all these things are swept aside
By bloody hands, time can't deny
An' are washed away by your genocide
An' history hides the lies of our civil wars

[Guitar Solo 1]

[Pre-Chorus 1]
D'you wear a black armband when they shot the man
Who said peace could last forever?
An' in my first memories, they shot Kennedy
I went numb when I learned to see
So I never fell for Vietnam
We got the wall in D.C. to remind us all
That you can't trust freedom when it's not in your hands
When everybody's fightin' for their promised land

[Chorus]
And I don't need your civil war
It feeds the rich, while it buries the poor
Your power hungry, sellin' soldiers in a human grocery store
Ain't that fresh? I don't need your civil war
Ooh, no, no, no, no, no, no

[Bridge]
Look at the shoes you're filling
Look at the blood we're spilling
Look at the world we're killing
The way we've always done before
Look in the doubt we've wallowed
Look at the leaders we've followed
Look at the lies we've swallowed
An' I don't want to hear no more

[Verse 2]
My hands are tied
For all, I've seen has changed my mind
But still, the wars go on, as the years go by
With no love of God or human rights
An' all these dreams are swept aside
By bloody hands of the hypnotized
Who carry the cross of homicide
And history bears the scars of our civil wars

[Guitar Solo 2]

[Pre-Chorus 2]
We practice selective annihilation
Of mayors and government officials
For example, to create a vacuum
Then we fill that vacuum
As popular war advances
Peace is closer

[Chorus]
I don't need your civil war
It feeds the rich, while it buries the poor
Your power hungry, sellin' soldiers in a human grocery store
Ain't that fresh? I don't need your civil war
No no no no no no no no no no no no
I don't need your civil war
I don't need your civil war
Your power hungry, sellin' soldiers in a human grocery store
Ain't that fresh? I don't need your civil war
No no no no no no no no no no, no, no
I don't need one more war
Ooh, I don't need one more war
No no no, no woah, no woah

[Outro]
What's so civil 'bout war anyway?",1998,0,Guns N’ Roses
"[Verse 1: Izzy Stradlin]
I try and feel the sunshine, you bring the rain
You try and hold me down with your complaints
You cry and moan and complain, you whine an tear
Up to my neck in sorrow the touch you bring

[Pre-Chorus: Izzy Stradlin]
You just don't step inside to, to 14 years
So hard to keep my own head, that's what I say and you know
I've been the beggar, I've played the thief
I was the dog they all tried to beat

[Chorus: Axl Rose with Izzy Stradlin]
But it's been 14 years of silence
It's been 14 years of pain
It's been 14 years that are gone forever and I'll never have again

[Verse 2: Izzy Stradlin]
Your stupid girlfriends tell you, that I'm to blame
Well, they're all used up has-beens out of the game
This time I'll have the last word, you hear what I say?
I tried to see it your way, it won't work today

[Pre-Chorus: Izzy Stradlin]
You just don't step inside to, to 14 years
So hard to keep my own head, that's what I say, you know
I've been the dealer hangin' on your street
I was the dog they all tried to beat

[Chorus: Axl Rose with Izzy Stradlin]
But it's been 14 years of silence
It's been 14 years of pain
It's been 14 years that are gone forever and I'll never have again

[Verse 3: Izzy Stradlin]
Bullshit and contemplation, gossip's their trade
If they knew half the real truth, what would they say?
Well I'm past the point of concern, it's time to play
These last four years of madness sure put me straight

[Outro: Izzy Stradlin]
You don't get back 14 years in just one day
So hard to keep my own head, just go away, you know
Just like a hooker, she said, ""Nothin's for free""
Oh, I tried to see it your way
I tried to see it your way",1998,0,Guns N’ Roses
"[Verse 1]
Yesterday, there was so many things I was never told
Now that I'm starting to learn, I feel I'm growing old
'Cause yesterday's got nothing for me
Old pictures that I'll always see
Time just fades the pages in my book of memories
Prayers in my pocket, and no hand in destiny
I'll keep on movin' along with no time to plant my feet
'Cause yesterday's got nothing for me
Old pictures that I'll always see
Some things could be better if we'd all just let them be

[Chorus]
Ooh, yesterday's got nothing for me
Yesterday's got nothing for me
Got nothing for me, ooh, yeah

[Guitar Solo]

[Verse 2]
Yesterday, there were so many things I was never shown
Suddenly, this time I found I'm on the streets and I'm all alone
Yesterday's got nothing for me
Old pictures that I'll always see
I ain't got time to reminisce old novelties

[Chorus]
Ooh, yesterday's got nothing for me
Yesterday's, ooh, got nothing for me
Yesterday's got nothing for me
Yesterday

[Outro]
Yesterday",1998,0,Guns N’ Roses
"[Intro: Axl Rose]
Ooh, ooh
Hey

[Verse 1: Axl Rose]
Mama, take this badge from me
I can't use it anymore
It's gettin' dark, too dark to see
Feels like I'm knockin' on heaven's door

[Chorus: Axl Rose]
Knock-knock-knockin' on heaven's door, hey, hey, hey hey yeah
Knock-knock-knockin' on heaven's door, ooh
Knock-knock-knockin' on heaven's door, ooh-oh yeah
Knock-knock-knockin' on heaven's door, ayy hey yeah
Ooh-oh yeah, oh yeah, aw

[Verse 2: Axl Rose]
Mama, put my guns in the ground (Ooh)
I can't shoot them anymore (Ooh)
That cold black cloud is comin' down (Ooh)
Feels like I'm knockin' on heaven's door (Ooh)

[Chorus: Axl Rose]
Knock-knock-knockin' on heaven's door, hey, hey, hey hey yeah
Knock-knock-knockin' on heaven's door
Knock-knock-knockin' on heaven's door, ooh yeah
Knock-knock-knockin' on heaven's door, ayy hey yeah
Ooh

[Guitar Solo]

[Spoken: Josh Richman]
You just better start sniffing your own rank subjugation, Jack
Because it's just you against your tattered libido
The bank and the mortician, forever, man
And it wouldn't be luck if you could get out of life alive

[Outro: Axl Rose, Choir & Both]
Knock-knock-knockin' on heaven's door, hey, hey, hey hey yeah
Knock-knock-knockin' on heaven's door
Knock-knock-knockin' on heaven's door, ooh yeah
Knock-knock-knockin' on heaven's door
Knock-knock-knockin' on heaven's door, ooh, no, no, no, woah
Knock-knock-knockin' on heaven's door
Knock-knock-knockin' on heaven's door, no, no, no, woah, no
Knock-knock-knockin' on heaven's door, woah, woah, woah, yeah
Knock-knock-knockin' on heaven's door
Knock-knock-knockin' on heaven's door, ooh yeah
Knock-knock-knockin' on heaven's door
Knock-knock-knockin' on heaven's door, woah, woah, woah
Woah, woah, yeah, oh",1998,0,Guns N’ Roses
