lyrics,year,lable,name
"Village (Village) People (People-le)
Now is the time... (right now, right now-ow)
Village (Village) People (People-le)
Your fight is mine (your fight is mine, your fight is mine, your fight is mine)
Village (Village) People (People-le)
Let's fight for the right (and do it while it's daylight)
Village (Village) People (People)
Your freedom's in sight (you'll have yourself with midnight)
Village (Village) People (People)
We can't be denied (the signs are on our side now)

Now (right now), we are one (we are o-o-one)
Take our place (take our place), In the sun (in the su-u-un)
To be free (to be free), we must be (we must be)
All for one (all for o-o-o-one)
Yes (yes), we are strong (we are stro-o-ong)
We are life (we are life), we belong (and we belong)
Do your part (do your part), Write a song (write a song)
The time has come (the time has co-o-o-ome)

Village (Village) People (People)
We know who we are (write it on the wall now)
Village (Village) People (People)
Follow your star (we're right and standing tall now)
Village (Village) People (People)
The world's gonna know (I said it's time for liberation, yeah)
Village (Village) People (People)
A force on the ground (you're known throughout the nation)
Village (Village) People (People)
So misunderstood... (in every situation)

Now (right now), we are one (we are o-o-one)
Take our place (take our place), in the sun (in the sun)
To be free (to be free), we must be (we must be)
All for one (all for o-o-o-one)
Yes (yes), we are strong (we are stro-o-ng )
We are life (we are life), we belong (and we belong)
Do your part (do your part), Write a song (write a song)
The time has come (the time has co-o-o-ome)

Village (Village) People (People-le)
Now is the time... (right now, right now, right now)
Village (Village) People (People-le)
Your fight is mine (your fight is mine, your fight is mine, mine, mine)
Village (Village) People (People-le)
Let's fight for the right (and do it while it's daylight)
Village (Village) People (People)
Your freedom's in sight (you'll have yourself midnight, midnight)
Village (Village) People (People)
We can't be denied (can't, write it, it's on the wall, it's on the wall)
Village (Village) People (People)
We know who we are (I said we're right and standing tall, yeah)
Village (Village) People (People)
Follow your star (we know who we are, time for liberation)
Village (Village) People (People)
The world's gonna know",1977,0,Village People
"[Verse 1]
She was more like a beauty queen from a movie scene
I said, ""Don't mind, but what do you mean, I am the one
Who will dance on the floor in the round?""
She said I am the one
Who will dance on the floor in the round
She told me her name was Billie Jean
As she caused a scene
Then every head turned with eyes that dreamed of bein' the one
Who will dance on the floor in the round

[Pre-Chorus 1]
People always told me, ""Be careful of what you do
Don't go around breakin' young girls' hearts"" (Hee-hee)
And mother always told me, ""Be careful of who you love
And be careful of what you do (Oh-oh)
'Cause the lie becomes the truth"" (Oh-oh)
Hey-ay

[Chorus]
Billie Jean is not my lover
She's just a girl who claims that I am the one (Oh, baby)
But the kid is not my son, hoo!
She says I am the one (Oh, baby)
But the kid is not my son (Hee-hee-hee, no-no-no, hee-hee-hee)
Hoo!

[Verse 2]
For forty days and for forty nights, the law was on her side
But who can stand when she's in demand?
Her schemes and plans
'Cause we danced on the floor in the round, hee!
So take my strong advice, just remember to always think twice
(Don't think twice) Do think twice! (A-hoo!)
She told my baby we'd danced till three, then she looked at me
Then showed a photo of a baby cryin', his eyes were like mine (Oh, no)
'Cause we danced on the floor in the round, baby
(Ooh, hee-hee-hee)

[Pre-Chorus 2]
People always told me, ""Be careful of what you do
And don't go around breakin' young girls' hearts""
(Don't break no hearts!) (Hee-hee)
But she came and stood right by me
Just the smell of sweet perfume (Ha-oh)
This happened much too soon (Ha-oh, ha-ooh)
She called me to her room (Ha-oh, hoo!)
Hey-ay

[Chorus]
Billie Jean is not my lover (Hoo!)
She's just a girl who claims that I am the one
But the kid is not my son
No-no-no, no-no-no-no-no-no (Hoo!)
Billie Jean is not my lover
She's just a girl who claims that I am the one (Oh baby)
But the kid is not my son (Oh, no, no)
She says I am the one (Oh baby)
But the kid is not my son (No, hee-hee!)

[Break]
Ah, hee-hee-hee!
Hee! Hoo!

[Chorus]
She says I am the one, but the kid is not my son
No-no-no, hoo! (Ouw!)
Billie Jean is not my lover
She's just a girl who claims that I am the one
(You know what you did to me, baby)
But the kid is not my son
No-no-no, no-no-no-no (No-no-no, no-no-no)
She says I am the one
But the kid is not my son (No-no-no-no)

[Outro]
She says I am the one
You know what you did
She says he is my son
Breakin' my heart, babe
She says I am the one
Billie Jean is not my lover
Billie Jean is not my lover
Billie Jean is not my lover (She is just a girl)
Billie Jean is not my lover (She is just a girl)
(Don't call me Billie Jean)
Billie Jean is not my lover (She is just a girl)
(Hoo! She's not at the scene)
Billie Jean is not (Hee! Aaow! Ooh!)
Billie Jean is",2008,1,Michael Jackson
"[Verse 1]
They told him, ""Don't you ever come around here
Don't wanna see your face, you better disappear""
The fire's in their eyes and their words are really clear
So beat it, just beat it (Ooh!)
You better run, you better do what you can (Ooh!)
Don't wanna see no blood, don't be a macho man (Ooh!)
You wanna be tough, better do what you can
So beat it, but you wanna be bad

[Chorus]
Just beat it, beat it, beat it, beat it
No one wants to be defeated
Showin' how funky and strong is your fight
It doesn't matter who's wrong or right
Just beat it (Beat it)
Just beat it (Beat it)
Just beat it (Beat it)
Just beat it (Beat it, uh)

[Verse 2]
They're out to get you, better leave while you can
Don't wanna be a boy, you wanna be a man
You wanna stay alive, better do what you can
So beat it, just beat it (Ooh!)
You have to show them that you're really not scared (Ooh!)
You're playin' with your life, this ain't no truth or dare (Ooh!)
They'll kick you, then they'll beat you, then they'll tell you it's fair
So beat it, but you wanna be bad

[Chorus]
Just beat it, beat it, beat it, beat it
No one wants to be defeated
Showin' how funky and strong is your fight
It doesn't matter who's wrong or right
Just beat it, beat it, beat it, beat it
No one wants to be defeated
Showin' how funky and strong is your fight
It doesn't matter who's wrong or right
Just beat it (Beat it, beat it, beat it)
Beat it (Beat it, beat it, ha, ha, ha, ha)
Beat it (Beat it, beat it)
Beat it (Beat it, beat it)
Beat it (Beat it, beat it)

[Guitar Solo]

[Chorus]
Beat it, beat it, beat it, beat it
No one wants to be defeated
Showin' how funky and strong is your fight
It doesn't matter who's wrong or right (Who's right)
Just beat it, beat it, beat it, beat it (Hoo-hoo!)
No one wants to be defeated (Oh, lord)
Showin' how funky (Hee-hee!) and strong is your fight (Hee-hee-hee!)
It doesn't matter who's wrong or right
Just beat it, beat it, beat it, beat it
No one wants to be defeated (Oh-no!)
Showin' how funky (Hoo-hoo!) and strong is your fight (Hee-hee! Hoo!)
It doesn't matter who's wrong or right
Just beat it, beat it, beat it, beat it
No one wants to be defeated
Showin' how funky and strong is your fight
It doesn't matter who's wrong or right (Who's right)
Just beat it, beat it, beat it, beat it (Hoo-hoo!)
No one wants to be defeated",2008,1,Michael Jackson
"[Skit]
Hey!
What?
Turn that off!
Dad, this is the best part!
Turn it off!
No!
It’s too late for this, turn it off!
Dad, this is the best part, come on!
No, turn it off now!
No, this is the, I want to listen to it, okay?
You’ve got things to do tomorrow
Yeah, right. Too late. Sure. Eat this

[Intro]
Aaow!
Aaow!

[Verse 1]
I took my baby on a Saturday bang
Boy, is that girl with you?
Yes, we're one and the same
Now, I believe in miracles
And a miracle has happened tonight
Hee!

[Chorus]
But, if you're thinking about my baby
It don't matter if you're black or white
Ooh!

[Verse 2]
They print my message in the Saturday sun
I had to tell them I ain't second to none
And I told 'em about equality
And it's true, either you're wrong or you're right
Hoo!

[Chorus]
But, if you're thinking about my baby
It don't matter if you're black or white
Hoo!
Gone withca girl!
Hee-hee!

[Bridge]
I am tired of this devil
I am tired of this stuff
I am tired of this business
So when the going gets rough
I ain't scared of your brother
I ain't scared of no sheets
I ain't scared of nobody
Girl, when the going gets mean

[Rap: L.T.B.]
Protection for gangs, clubs and nations
Causing grief in human relations
It's a turf war on a global scale
I'd rather hear both sides of the tale
See, it's not about races
Just places, faces
Where your blood comes from is where your space is
I've seen the bright get duller
I'm not going to spend my life being a color

[Verse 3]
Don't tell me you agree with me
When I saw you kicking dirt in my eye
Hee-hee!

[Chorus]
But, if you're thinking about my baby
It don't matter if you're black or white
I said if you're thinking of being my baby
It don't matter if you're black or white
I said if you're thinking of being my brother
It don't matter if you're black or white

[Outro]
Alright, alright
Ah, dah, ah (Ooh, ooh, ooh, ooh)
Dah, ah, dah, alright
Ooh, ooh, yeah, yeah, yeah now
Alright, alright (Ooh, ooh, ooh, ooh)
Shamone, don't
Ooh, ooh, yeah, yeah, yeah now
Alright (Ooh, ooh, ooh, ooh)
It's black, it's white
It's tough for you to get by (Ooh, ooh, yeah, yeah, yeah)
It's black, it's white, hoo! (Ooh, ooh, ooh, ooh)
It's black, it's white
It's tough for you to get by (Ooh, ooh, yeah, yeah, yeah)
It's black, it's white, hoo! (Shamone, dah)",2008,1,Michael Jackson
"[Intro: Child]
Think about the generations and say that we wanna make it a better place for our children, and our children's children, so that they, they, they know it's a better world for them, and think, if they can make it a better place...

[Verse 1]
There's a place in your heart
And I know that it is love
And this place could be much brighter than tomorrow
And if you really try
You'll find there's no need to cry
In this place, you will feel there's no hurt or sorrow

[Pre-Chorus 1]
There are ways to get there
If you care enough for the living
Make a little space
Make a better place

[Chorus]
Heal the world
Make it a better place
For you and for me and the entire human race
There are people dying
If you care enough for the living
Make a better place for you and for me

[Verse 2]
If you want to know why
There's a love that cannot lie
Love is strong, it only cares for joyful giving
If we try, we shall see
In this bliss, we cannot feel
Fear or dread, we stop existing and start living

[Pre-Chorus 2]
Then it feels that always
Love's enough for us growing
So make a better world
To make a better world

[Chorus]
Heal the world
Make it a better place
For you and for me and the entire human race
There are people dying
If you care enough for the living
Make a better place for you and for me

[Bridge]
And the dream we were conceived in will reveal a joyful face
And the world we once believed in will shine again in grace
Then why do we keep strangling life?
Would this Earth crucify its soul?
Though it's plain to see
This world is heavenly
Be God's glow

[Verse 3]
We could fly so high
Let our spirits never die
In my heart, I feel you are all my brothers
Create a world with no fear
Together, we'll cry happy tears
See the nations turn their swords into
Ploughshares

[Pre-Chorus 3]
We could really get there
If you cared enough for the living
Make a little space
To make a better place

[Chorus]
Heal the world
Make it a better place
For you and for me
And the entire human race
There are people dying
If you care enough for the living
Make a better place
For you and for me
Heal the world
Make it a better place
For you and for me and the entire human race
There are people dying
If you care enough for the living
Make a better place for you and for me
Heal the world (Heal the world)
Make it a better place
For you and for me and the entire human race
There are people dying
If you care enough for the living
Make a better place for you and for me

[Post-Chorus]
There are people dying
If you care enough for the living
Make a better place for you and for me
There are people dying
If you care enough for the living
Make a better place for you and for me

[Outro: Michael Jackson & Child]
Make a better place (You and for me)
Make a better place (You and for me)
Make a better place (You and for me)
(You and for me)
Heal the world we live in (You and for me)
Save it for our children (You and for me)
Heal the world we live in (You and for me)
Save it for our children (You and for me)
Heal the world we live in (You and for me)
Save it for our children (You and for me)
Heal the world we live in (You and for me)
Save it for our children",2008,1,Michael Jackson
"[Instrumental Break]

[Verse 1]
Another day has gone
I'm still all alone
How could this be
You're not here with me
You never said goodbye
Someone tell me why
Did you have to go
And leave my world so cold

[Pre-Chorus]
Every day I sit and ask myself
How did love slip away
Something whispers in my ear and says

[Chorus]
That you are not alone
I am here with you
Though you're far away
I am here to stay
But you are not alone
I am here with you
Though we're far apart
You're always in my heart
But you are not alone

[Post-Chorus]
'Lone, 'lone
Why, 'lone

[Verse 2]
Just the other night
I thought I heard you cry
Asking me to come
And hold you in my arms
I can hear your prayers
Your burdens I will bear
But first I need your hand
Then forever can begin

[Pre-Chorus]
Every day I sit and ask myself
How did love slip away
Something whispers in my ear and says

[Chorus]
That you are not alone
I am here with you
Though you're far away
I am here to stay
But you are not alone
I am here with you
Though we're far apart
You're always in my heart
But you are not alone

[Bridge]
Oh, whisper three words and I'll come running
And girl you know that I'll be there
I'll be there

[Chorus]
That you are not alone
I am here with you
Though you're far away
I am here to stay
But you are not alone
I am here with you
Though we're far apart
You're always in my heart
That you are not alone (You are not alone)
I am here with you (I am here with you)
Though you're far away (Though you're far away, you and me)
I am here to stay
But you are not alone (You are always in my heart)
I am here with you
Though we're far apart
You're always in my heart
For you are not alone (Not alone, oh)

[Outro]
You are not alone
You are not alone
Say it again
You are not alone
You are not alone
Not alone, not alone
If you just reach out for me, girl
In the morning, in the evening
Not alone, not alone
You and me, not alone, oh!
Together, together
Not not being alone!
Not not being alone!
You believe in me!",2008,1,Michael Jackson
"[Verse 1: Michael Jackson]
It's close to midnight
Something evil's lurking in the dark
Under the moonlight
You see a sight that almost stops your heart
You try to scream
But terror takes the sound before you make it
You start to freeze
As horror looks you right between your eyes
You're paralyzed

[Chorus 1: Michael Jackson]
'Cause this is thriller
Thriller night
And no one's gonna save you
From the beast about to strike
You know it's thriller
Thriller night
You're fighting for your life
Inside a killer
Thriller tonight, yeah, ooh

[Verse 2: Michael Jackson]
You hear the door slam
And realize there's nowhere left to run
You feel the cold hand
And wonder if you'll ever see the sun
You close your eyes
And hope that this is just imagination
(Girl)
But all the while
You hear a creature creeping up behind
You're out of time

[Chorus 2: Michael Jackson]
'Cause this is thriller, thriller night
There ain't no second chance
Against the thing with 40 eyes, girl
(Ooh, ooh)
Thriller, thriller night
You're fighting for your life
Inside a killer, thriller tonight

[Bridge: Michael Jackson]
Night creatures call and the dead start to walk in their masquerade
There's no escaping the jaws of the alien this time
They're open wide
This is the end of your life, ooh

[Verse 3: Michael Jackson]
They're out to get you
There's demons closing in on every side
(Ooh)
They will possess you
Unless you change that number on your dial
Now is the time
For you and I to cuddle close together, yeah
All through the night
I'll save you from the terror on the screen
I'll make you see

[Chorus 3: Michael Jackson]
That this is thriller, thriller night
'Cause I can thrill you more
Than any ghoul would ever dare try
Thriller, thriller night
So let me hold you tight
And share a killer, thriller, chiller
Thriller here tonight
'Cause this is thriller, thriller night
Girl, I can thrill you more
Than any ghoul would ever dare try
(Ooh, ooh)
Thriller, thriller night
So let me hold you tight
And share a killer, thriller
I'm gonna thrill you tonight

[Outro: Vincent Price & Michael Jackson]
Darkness falls across the land
The midnight hour is close at hand
Creatures crawl in search of blood
To terrorize y'all's neighborhood
I'm gonna thrill you tonight
And whosoever shall be found
Without the soul for getting down
Must stand and face the hounds of hell
And rot inside a corpse's shell
I'm gonna thrill you tonight
(Thriller, ooh, thriller)
I'm gonna thrill you tonight
(Thriller night, thriller)
I'm gonna thrill you tonight
Ooh, babe, I'm gonna thrill you tonight
Thriller night, babe
The foulest stench is in the air
The funk of forty thousand years (Thriller night, thriller)
And grisly ghouls from every tomb
Are closing in to seal your doom
And though you fight to stay alive
Your body starts to shiver (I'm gonna thrill you tonight)
For no mere mortal can resist
The evil of the thriller!
AHAHAHAHAHAHAHAHA
AHAHAHAHAHAHAHAHA!",2008,1,Michael Jackson
"[Spoken Intro]
The way she came into the place, I knew right then and there
There was something different about this girl
The way she moved her hair, her face, her lines
Divinity in motion

As she stalked the room, I could feel the aura of her presence
Every head turned feeling passion and lust
The girl was persuasive, the girl I could not trust
The girl was bad, the girl was dangerous

[Verse 1]
I never knew but I was walkin' the line (Hee!)
""Come go with me"", I said, ""I have no time"" (Hee-hee!)
She said ""Don't you pretend we didn't talk on the phone"" (Hee!)
My baby cried, she left me standin' alone (Hee! Hee!)

[Chorus]
She's so dangerous
The girl is so dangerous (Hee-hee!)
Take away my money, throw away my time
You can call me honey, but you're no damn good for me

[Spoken Interlude]
She came at me in sections with the eyes of desire
I fell trapped into her web of sin
A touch, a kiss
A whisper of love, I was at the point of no return

Deep in the darkness of passion's insanity
I felt taken by lust's strange inhumanity
This girl was persuasive, this girl I could not trust
The girl was bad, the girl was dangerous

[Verse 2]
I never knew but I was livin' in vain (Hee!)
She called my house, she said ""You know my name""
(You know my name!)
""And don't you pretend you never did me before""
(Don't you, don't you, baby!) (Hee!)
With tears in her eyes, my baby walked out the door
(Don't you, don't you, don't) (Hee! Hee! Hee! Hee!)

[Chorus]
She's so dangerous
The girl is so dangerous (Hee-hee!)
Take away my money, throw away my time
You can call me honey, but you're no damn good for me

[Alternate Chorus]
Dangerous
The girl is so dangerous (Hee-hee!) (Dog gone!)
I have to pray to God, 'cause I know how lust can blind
It's a passion in my soul, but you're no damn lover friend of mine

[Ad-Libs]
Hee-hee!
Oooh!
Oooh!
Hoo!

[Bridge]
I cannot sleep alone at night
My baby left me here tonight
I cannot cope 'til it's all right
You and your manipulation, you hurt my baby

[Spoken Interlude]
And then it happened, she touched me
For the lips of a strange woman drop as a honeycomb
And her mouth was smoother than oil, but her inner spirit and words were as sharp as a two-edged sword
But I loved it, 'cause it's dangerous

[Chorus]
Dangerous (Hee!)
The girl is so dangerous (Hee-hee!) (Hee!)
Take away my money, throw away my time (Oh!)
You can call me honey, but you're no damn good for me

Dangerous (Hee!)
The girl is so dangerous (Hee-hee!) (Hee!)
Take away my money, throw away my time (Dog gone!) (Oh!)
You can call me honey, but you're no damn good for me

Dangerous (Hee!)
The girl is so dangerous (Hee-hee!)
Take away my money, throw away my time (Woah!) (Oh, yeah!)
You can call me honey, but you're no damn good for me

[Alternate Chorus]
Dangerous (Hee! Hee!)
The girl is so dangerous (Hoo-hee! Hoo!) (Dog gone!)
I have to pray to God, 'cause I know how lust can blind
It's a passion in my soul, but you're no damn lover friend of mine

[Ad-Libs]
Hoo!
Hoo!
Hoo!
My baby
You been, you take, uh
You don't, don't, don't
You turn, my baby
Hoo!
Hoo!
Hoo!
Hoo!
Hoo!
Hoo!
Dan'gerus
Dan'gerus, dan'gerus
Hoo!
Dan'gerus, dan'gerus
Hoo!",2008,1,Michael Jackson
"[Verse 1]
Your butt is mine, gonna tell you right, ah
Just show your face in broad daylight, ah
I'm tellin' you on how I feel, ah
Gonna hurt your mind, don't shoot to kill
Shamone, ah, shamone
Lay it on me, ah, all right
Ah, I'm givin' you on count of three, ah
Just show your stuff or let it be, ah
I'm tellin' you, just watch your mouth, ah
I know your game, what you're about

[Pre-Chorus 1]
Well, they say the sky's the limit
And to me, that's really true, ah
But my friend, you have say nothing
Just wait 'til I get through!

[Chorus]
Because I'm bad, I'm bad! Shamone! (Bad, bad, really, really bad)
You know I'm bad, I'm bad (Bad, bad)
You know it! (Really, really bad)
You know I'm bad, I'm bad! Shamone! (Bad, bad)
You know! (Really, really bad)
And the whole world has to answer right now
Just to tell you once again: Who's bad?

[Verse 2]
The word is out, you're doin' wrong, ah
Gonna lock you up before too long, ah
Your lyin' eyes gon'na tell you right (ah ah)
So listen up, don't make a fight (ah ah)
Your talk is cheap, you're not a man, ah
You're throwin' stones to hide your hands

[Pre-Chorus 1]
Well, they say the sky's the limit
And to me, that's really true, ah
But my friend, you have say nothing
Just wait 'til I get through!

[Chorus]
Because I'm bad, I'm bad! Shamone! (Bad, bad, really, really bad)
You know I'm bad, I'm bad (Bad, bad)
You know it! (Really, really bad)
You know I'm bad, I'm bad! You know it! (Bad, bad)
You know! (Really, really bad)
And the whole world has to answer right now
Just to tell you once again: Who's bad?

[Organ Solo]

[Pre-Chorus 2]
We can change the world tomorrow
This could be a better place, ah
If you don't like what I'm sayin'
Then won't you slap my face?!

[Chorus]
Because I'm bad, I'm bad! Shamone! (Bad, bad, really, really bad)
You know I'm bad, I'm bad (Bad, bad)
You know it! (Really, really bad)
You know I'm bad, I'm bad (Bad, bad)
You know it, you know! (Really, really bad)
And the whole world has to answer right now (Hoo! Hoo!)
Just to tell you once again (Hoo!)
You know I'm bad, I'm bad! Shamone! (Bad, bad, really, really bad)
You know I'm bad, I'm bad (Bad, bad)
You know it, you know it! (Really, really bad)
You know, you know! (Bad, bad)
You know, shamone! (Really, really bad)
And the whole world has to answer right now
Just to tell you once again
You know I'm smooth, I'm bad, you know it! (Bad, bad, really, really bad)
You know I'm bad, I'm bad (Bad, bad, really, really bad)
You know, you know, you know it (Bad, bad, really, really bad)
Come on! (Really, really bad)
And the whole world has to answer right now (Hoo!)
Just to tell you once again
You know I'm bad, I'm bad, you know it! (Bad, bad, really, really bad)
You know I'm bad, you know, woo! (Bad, bad, really, really bad)
You know I'm bad, I'm bad! (Bad, bad)
You know it, you know! (Really, really bad)
And the whole world has to answer right now
Just to tell you once again: Who's bad?",2008,1,Michael Jackson
