lyrics,year,lable,name
"[Intro]
...we came in?

[Verse: Roger Waters]
So ya thought ya might like to go to the show
To feel the warm thrill of confusion, that space cadet glow
Tell me, is something eluding you, sunshine?
Is this not what you expected to see?
If you wanna find out what's behind these cold eyes
You'll just have to claw your way through this disguise

[Bridge: Roger Waters]
Lights!
Roll the sound effects!
Action!
Drop it, drop it on 'em
Drop it, drop it on them!
*Shots*

[Outro]
*Baby Crying*",1979,0,Pink Floyd
"[Intro]
*Baby Crying*

[Verse 1: David Gilmour]
Momma loves her baby
And Daddy loves you too
And the sea may look warm to you, babe
And the sky may look blue
Ooh-ooh-ooh-ooh, babe
Ooh-ooh-ooh, baby blue
Ooh-ooh-ooh-ooh-ooh-ooh, babe

[Verse 2: Roger Waters]
If you should go skating
On the thin ice of modern life
Dragging behind you, the silent reproach
Of a million tear stained eyes
Don't be surprised when a crack in the ice
Appears under your feet
You'll slip out of your depth and out of your mind
With your fear flowing out behind you
As you claw the thin ice",1979,0,Pink Floyd
"[Verse: Roger Waters]
Daddy's flown across the ocean
Leaving just a memory
A snapshot in the family album
Daddy, what else did you leave for me?
Daddy, what'd ya leave behind for me?
All in all, it was just a brick in the wall
All in all, it was all just bricks in the wall

[Outro: Roger Waters]
Hey!
*Children playing*",1979,0,Pink Floyd
"[Intro: Roger Waters]
You! Yes, you! Stand still, laddie!

[Verse 1: Roger Waters]
When we grew up and went to school
There were certain teachers who
Would hurt the children in any way they could (Oof!)
By pouring their derision upon anything we did
Exposing every weakness
However carefully hidden by the kid

[Verse 2: Roger Waters]
But in the town, it was well known, when they got home at night
Their fat and psychopathic wives would thrash them within inches of their lives",1979,0,Pink Floyd
"[Intro]

[Verse: Roger Waters & David Gilmour]
We don't need no education
We don't need no thought control
No dark sarcasm in the classroom
Teacher, leave them kids alone
Hey! Teacher! Leave them kids alone!

[Chorus: Roger Waters & David Gilmour]
All in all, it's just another brick in the wall
All in all, you're just another brick in the wall

[Verse: Islington Green School Students]
We don't need no education
We don't need no thought control
No dark sarcasm in the classroom
Teachers, leave them kids alone
Hey! Teacher! Leave us kids alone!

[Chorus: Islington Green School Students]
All in all, you're just another brick in the wall
All in all, you're just another brick in the wall

[Guitar Solo]

[Outro: Roger Waters]
Wrong, do it again! (*Children playing*)
Wrong, do it again!
If you don't eat your meat, you can't have any pudding!
(Wrong, do it again!)
How can you have any pudding if you don't eat your meat?
(Wrong, do it again!)
You! Yes! You behind the bike sheds! Stand still, laddie!
(If you don't eat your meat, you can't have any pudding!
How can you have any pudding if you don't eat your meat?)
(You! Yes! You behind the bike sheds! Stand still, laddie!)
*Children playing*
*Phone beeping sound*",1979,0,Pink Floyd
"[Verse 1: Roger Waters]
Mother, do you think they'll drop the bomb?
Mother, do you think they'll like this song?
Mother, do you think they'll try to break my balls?
Ooh-ah, Mother, should I build the wall?

[Verse 2: Roger Waters]
Mother, should I run for president?
Mother, should I trust the government?
Mother, will they put me in the firing line?
Ooh-ah, is it just a waste of time?

[Chorus: David Gilmour]
Hush now, baby, baby, don't you cry
Mamma's gonna make all of your nightmares come true
Mamma's gonna put all of her fears into you
Mamma's gonna keep you right here, under her wing
She won't let you fly, but she might let you sing
Mamma's gonna keep baby cosy and warm

[Post-Chorus]
Ooh babe, ooh babe, ooh babe
Of course, Mamma's gonna help build the wall

[Guitar Solo]

[Verse 3: Roger Waters]
Mother, do you think she's good enough... For me?
Mother, do you think she's dangerous... To me?
Mother, will she tear your little boy apart?
Ooh-ah, Mother, will she break my heart?

[Chorus: David Gilmour]
Hush now, baby, baby, don't you cry
Mamma's gonna check out all your girlfriends for you
Mamma won't let anyone dirty get through
Mamma's gonna wait up until you get in
Mamma will always find out where you've been
Mamma's gonna keep baby healthy and clean

[Post-Chorus]
Ooh babe, ooh babe, ooh babe
You'll always be ""baby"" to me

[Outro: Roger Waters]
Mother, did it need to be so high?",1979,0,Pink Floyd
"[Spoken Intro: Harry Waters]
Look, Mummy!
There's an airplane up in the sky

[Verse 1: David Gilmour]
Ooh-ooh, ooh, ooh, ooh
Ooh-ooh, ooh, ooh, ooh
Ooh-ooh, ooh, ooh, ooh
Did-did-did-did you see the frightened ones?
Did-did-did-did you hear the falling bombs?
Did-did-did-did you ever wonder why we had to run for shelter when the promise of a brave new world unfurled beneath the clear blue sky?

[Verse 2: David Gilmour]
Ooh-ooh, ooh, ooh, ooh
Ooh-ooh, ooh, ooh, ooh
Did-did-did-did you see the frightened ones?
Did-did-did-did you hear the falling bombs?
The flames are all long gone
But the pain lingers on

[Outro: David Gilmour]
Goodbye, blue sky
Goodbye, blue sky
Goodbye
Goodbye",1979,0,Pink Floyd
"[Intro]

[Verse: Roger Waters]
What shall we use to fill the empty spaces
Where we used to talk?
How shall I fill the final places?
How should I complete the wall?",1979,0,Pink Floyd
"[Verse 1: David Gilmour]
(Ah) I am just a new boy
A stranger in this town
Where are all the good times?
Who's gonna show this stranger around?

[Chorus: David Gilmour & Roger Waters]
Ooh, I need a dirty woman
Ooh, I need a dirty girl

[Verse 2: David Gilmour]
Will some woman in this desert land
Make me feel like a real man?
Take this rock-and-roll refugee
Ooh, baby, set me free

[Chorus: David Gilmour & Roger Waters]
Ooh, I need a dirty woman
Ooh, I need a dirty girl

[Guitar Solo]

[Chorus: David Gilmour & Roger Waters]
Ooh, I need a dirty woman
Ooh, I need a dirty girl

[Outro]
*Phone beeping*
""Hello?""
""Yes, a collect call for Mrs. Floyd from Mr. Floyd. Will you accept the charge from the United States?""
*Phone clicks*
""Oh, he hung up. That's your residence, right? Well, I wonder why he hung up. Is there supposed to be someone out there besides your wife there to answer?""
*Phone redials and beeps again*
""Hello?""
""This is the United States calling. Are we reaching...""
*Phone clicks*
""See, he keeps hanging up, and it's a man answering.""",1979,0,Pink Floyd
"[Intro]
""Oh my God! What a fabulous room! Are all these your guitars?""
(""I'm sorry sir, I didn't mean to startle you"")
""God! This place is bigger than our apartment!""
(""Let me know when you're entering a room"")
(""Yes, sir"")
""Um, can I get a drink of water?""
(""I was wondering about"")
""You want some, huh?""
(""Yes"")
""Oh wow! Hey, look at this tub! Wanna take a bath?""
(""I'll have to find out from Mrs. Bancroft what time she wants to meet us, for her main"")
""What are you watching?""
(""If you'll just let me know as soon as you can, Mrs. Bancroft... Mrs. Bancroft"")
""Hello?""
(""I don't understand"")
""Are you feeling okay?""

[Verse 1: Roger Waters]
Day after day, the love turns gray
Like the skin of the dying man
And night after night, we pretend it's all right
But I have grown older, and you have grown colder
And nothing is very much fun any more
And I can feel one of my turns coming on
I feel cold as a razor blade, tight as a tourniquet
Dry as a funeral drum

[Verse 2: Roger Waters]
Run to the bedroom, in the suitcase on the left
You'll find my favourite axe
Don't look so frightened, this is just a passing phase
One of my bad days
Would you like to watch TV? Or get between the sheets?
Or contemplate the silent freeway?
Would you like something to eat? Would you like to learn to fly?
Would ya? Would you like to see me try?
Ah, no!

[Outro: Roger Waters]
Would you like to call the cops?
Do you think it's time I stopped?
Why are you running away?",1979,0,Pink Floyd
"[Hook: Roger Waters]
Ooh, babe, don't leave me now

[Verse 1: Roger Waters]
Don't say it's the end of the road
Remember the flowers I sent
I need you, babe
To put through the shredder in front of my friends

[Hook: Roger Waters]
Oh, babe, don't leave me now

[Verse 2: Roger Waters]
How could you go?
When you know how I need you
(Need you, need you, need you, need you, need you, need you)
To beat to a pulp on a Saturday night

[Hook: Roger Waters]
Oh, babe, don't leave me now

[Verse 3: Roger Waters]
How can you treat me this way?
Running away
Ooh, babe, why are you running away?

[Outro: Roger Waters & David Gilmour]
Ooh, babe
Ooh, babe
Ooh, babe
Ooh, ooh
Argh!",1979,0,Pink Floyd
"[Intro]
*Sounds from TV*

[Verse: Roger Waters]
I don't need no arms around me
And I don't need no drugs to calm me
I have seen the writing on the wall
Don't think I need anything at all
No, don't think I'll need anything at all

[Chorus: Roger Waters]
All in all, it was all just bricks in the wall
All in all, you were all just bricks in the wall",1979,0,Pink Floyd
"[Verse: Roger Waters]
Goodbye, cruel world, I'm leaving you today
Goodbye, goodbye, goodbye
Goodbye, all you people, there's nothing you can say
To make me change my mind, goodbye",1979,0,Pink Floyd
"[Acoustic Guitar Intro]

[Verse 1: David Gilmour]
Hey you
Out there in the cold, getting lonely, getting old
Can you feel me?
Hey you
Standing in the aisles with itchy feet and fading smiles
Can you feel me?
Hey you
Don't help them to bury the light
Don't give in without a fight

[Verse 2: David Gilmour]
Hey you
Out there on your own, sitting naked by the phone
Would you touch me?
Hey you
With your ear against the wall, waiting for someone to call out
Could you touch me?
Hey you
Would you help me to carry the stone?
Open your heart, I'm coming home

[Guitar Solo]

[Bridge: Roger Waters]
But it was only fantasy
The wall was too high, as you can see
No matter how he tried, he could not break free
And the worms ate into his brain

[Breakdown]

[Verse 3: Roger Waters]
Hey you
Out there on the road, always doing what you're told
Can you help me?
Hey you
Out there beyond the wall, breaking bottles in the hall
Can you help me?
Hey you
Don't tell me there's no hope at all
Together we stand, divided we fall

[Outro: Roger Waters]
(We fall, we fall, we fall, we fall, we fall, we fall, we fall, we fall...)",1979,0,Pink Floyd
"[Intro]
""Well, only got an hour of daylight left. Better get started""
""Isn't it unsafe to travel at night?""
""It'll be a lot less safe to stay here. Your father's gonna pick up our trail before long""
""Can Lorca ride?""
""He'll have to ride. Lorca, time to go! Chengra, thank you for everything. Let's go.""
""Goodbye, Chengra""
""Goodbye, Missy!""
""I'll be back--one day""

[Refrain: Roger Waters & David Gilmour]
Is there anybody out there?
Is there anybody out there?
Is there anybody out there?
Ah, is there anybody out there?

[Instrumental Outro]",1979,0,Pink Floyd
"[Intro]
""But there's somebody else that needs taking care of in Washington...""
""Who's that?""
""Rose Pilchitt!""
""Rose Pilchitt? Who's that?""
*Kid screams in background*
(Shut up!)
""36-24-36 *Laughs* does that answer your question?""
(Oi! I've got a little black book with me poems in!)
""Who's she?""
""She was 'Miss Armoured Division' in 1961... ""

[Verse 1: Roger Waters]
I've got a little black book with my poems in
Got a bag with a toothbrush and a comb in
When I'm a good dog they sometimes throw me a bone in
I got elastic bands keeping my shoes on
Got those swollen hand blues
I've got thirteen channels of shit on the T.V. to choose from
I've got electric light
And I've got second sight
I've got amazing powers of observation

[Chorus 1: Roger Waters]
And that is how I know
When I try to get through
On the telephone to you
There will be nobody home

[Verse 2: Roger Waters]
I've got the obligatory Hendrix perm
And the inevitable pinhole burns
All down the front of my favourite satin shirt
I've got nicotine stains on my fingers
I've got a silver spoon on a chain
I've got a grand piano to prop up my mortal remains
I've got wild staring eyes
And I've got a strong urge to fly
But I've got nowhere to fly to (Fly to... fly to... fly to...)

[Chorus 2: Roger Waters]
Ooh, babe, when I pick up the phone
(""Surprise, surprise, surprise..."")
There's still nobody home

[Outro: Roger Waters]
I've got a pair of Gohills boots
And I've got fading roots",1979,0,Pink Floyd
"[Intro]
""Where the hell are you?
""Where the hell are you, Simon?"" *Shots*

[Verse: Roger Waters]
Does anybody here remember Vera Lynn?
Remember how she said that
We would meet again some sunny day?
Vera, Vera, what has become of you?
Does anybody else in here feel the way I do?",1979,0,Pink Floyd
"[Verse: Roger Waters]
Bring the boys back home
Bring the boys back home
Don't leave the children on their own, no, no
Bring the boys back home

[Outro]
""Wrong, do it again!""
*Knock* ""Time to go!""
""Are you feeling okay?""
""He keeps hanging up, and it's a man answering!""
""Hahahahaha!!!!!!""
Is there anybody out there?",1979,0,Pink Floyd
"[Intro]

[Verse 1: Roger Waters]
Hello? (Hello, hello, hello)
Is there anybody in there?
Just nod if you can hear me
Is there anyone home?
Come on (Come on, come on), now
I hear you're feeling down
Well, I can ease your pain
And get you on your feet again
Relax (Relax, relax, relax)
I'll need some information first
Just the basic facts
Can you show me where it hurts?

[Pre-Chorus 1: David Gilmour]
There is no pain, you are receding
A distant ship, smoke on the horizon
You are only coming through in waves
Your lips move, but I can't hear what you're saying
When I was a child, I had a fever
My hands felt just like two balloons
Now I've got that feeling once again
I can't explain, you would not understand
This is not how I am

[Chorus: David Gilmour]
I have become comfortably numb

[Guitar Solo 1]

[Chorus: David Gilmour]
I have become comfortably numb

[Verse 2: Roger Waters]
Okay (Okay, okay, okay)
Just a little pinprick
There'll be no more
But you may feel a little sick
Can you stand up? (Stand up, stand up)
I do believe it's working, good
That'll keep you going through the show
Come on, it's time to go

[Pre-Chorus 2: David Gilmour]
There is no pain, you are receding
A distant ship, smoke on the horizon
You are only coming through in waves
Your lips move, but I can't hear what you're saying
When I was a child, I caught a fleeting glimpse
Out of the corner of my eye
I turned to look, but it was gone
I cannot put my finger on it now
The child is grown, the dream is gone

[Chorus: David Gilmour]
I have become comfortably numb

[Guitar Solo 2]",1979,0,Pink Floyd
"[Intro: David Gilmour]
(Ah-ah) Ooh, ooh-hoo, ooh, ooh
(Ah-ah)
(Ah-ah)
(Ooh-ma, ah, ooh-pa) Must the show go on?
(Ooh-pa, take me home, take me home, take me home)
(Ooh-ma, let me go, let me go, let me go)

[Verse: David Gilmour]
There must be some mistake, I didn't mean to let them
Take away my soul, am I too old, is it too late?
(Ooh-ma, ooh-pa) Where has the feeling gone?
(Ooh-ma, ooh-pa) Will I remember the song?

[Outro: David Gilmour]
(Ooh, ooh, ah) The show must go on",1979,0,Pink Floyd
"[Intro]
""Three, two... fire!""

[Verse 1]
So ya thought ya might like to go to the show
To feel the warm thrill of confusion, that space cadet glow
I've got some bad news for you sunshine
Pink isn't well, he stayed back at the hotel
And they sent us along as a surrogate band
We're gonna find out where you fans really stand

[Verse 2]
Are there any queers in the theater tonight?
Get them up against the wall
(Against the wall)
Now there's one in the spotlight, he don't look right to me
Get him up against the wall
(Against the—)
And that one looks Jewish and that one's a coon!
Who let all of this riff-raff into the room?
There's one smoking a joint and another with spots
If I had my way, I'd have all of them shot!

[Instrumental Outro]",1979,0,Pink Floyd
"[Chorus: David Gilmour & Roger Waters]
Run, run, run, run
Run, run, run, run
Run, run, run, run
Run, run, run, run

[Verse 1: Roger Waters]
You better make your face up with your favourite disguise
With your button down lips and your roller blind eyes
With your empty smile and your hungry heart
Feel the bile rising from your guilty past
With your nerves in tatters as the cockleshell shatters
And the hammers batter down your door
You better run!

[Chorus: David Gilmour & Roger Waters]
Run, run, run, run
Run, run, run, run
Run, run, run, run
Run, run, run, run

[Verse 2: Roger Waters]
You better run all day and run all night
And keep your dirty feelings deep inside
And if you're taking your girlfriend out tonight
You better park the car well out of sight
'Cause if they catch you in the back seat trying to pick her locks
They're gonna send you back to Mother in a cardboard box
You better run!

[Synth Solo]

[Instrumental Outro]",1979,0,Pink Floyd
"[Intro]
""Eins, zwei, drei, alle!""
Ooh-ooh, you cannot reach me now
Ooh-ooh, no matter how you try
Goodbye, cruel world, it's over
Walk on by

[Verse 1: David Gilmour & Roger Waters]
Sitting in a bunker here behind my wall
Waiting for the worms to come (Worms to come)
In perfect isolation here behind my wall
Waiting for the worms to come

[Bridge: Roger Waters]
Testing. One. Two. One. Two. We’re all going to convene at 1:15 outside Brixton Town Hall where we will be going...

[Hook: Roger Waters]
(Waiting) To cut out the deadwood
(Waiting) To clean up the city
(Waiting) To follow the worms
(Waiting) To put on a black shirt
(Waiting) To weed out the weaklings
(Waiting) To smash in their windows and kick in their doors
(Waiting) For the final solution to strengthen the strain
(Waiting) To follow the worms
(Waiting) To turn on the showers and fire the ovens
(Waiting) For the queers and the coons and the reds and the Jews
(Waiting) To follow the worms

[Verse 2: David Gilmour & Roger Waters]
Would you like to see Britannia Rule again
My friend?
All you have to do is follow the worms
Would you like to send our coloured cousins home again
My friend?
All you need to do is follow the worms

[Outro]
Stop!",1979,0,Pink Floyd
"[Verse: Roger Waters]
I wanna go home
Take off this uniform and leave the show
But I'm waiting in this cell, because I have to know
(Have to know, have to know...)
Have I been guilty all this time?
(Have to know, have to know, have to know, have to know...)
(Time, time, time, time...)",1979,0,Pink Floyd
"[Instrumental Intro]

[Verse 1: Prosecutor]
Good morning, Worm your honour
The crown will plainly show the prisoner
Who now stands before you
Was caught red-handed showing feelings
Showing feelings of an almost human nature
This will not do
Call the schoolmaster!

[Verse 2: The Schoolmaster]
I always said he'd come to no good in the end your honour
If they'd let me have my way I could have flayed him into shape
But my hands were tied, the bleeding hearts and artists
Let him get away with murder, let me hammer him today

[Chorus 1: Pink (and Choir)]
Crazy, toys in the attic
I am crazy, truly gone fishing
They must have taken my marbles away!
(Crazy, toys in the attic, he is crazy)

[Verse 3: Wife]
You little shit, you're in it now, I hope they throw away the key
You should have talked to me more often than you did, but no!
You had to go your own way
Have you broken any homes up lately?
""Just five minutes, Worm your honour, him and me, alone""

[Verse 4: Mother]
Babe!
Come to mother baby, let me hold you in my arms
M'lud I never wanted him to get in any trouble
Why'd he ever have to leave me?
Worm, your honour, let me take him home

[Chrous 2: Pink (and Choir)]
Crazy, over the rainbow
I am crazy, bars in the window
There must have been a door there in the wall
When I came in
(Crazy, over the rainbow, he is crazy)

[Verse 5: The Judge]
The evidence before the court is incontrovertible
There's no need for the jury to retire
In all my years of judging, I have never heard before
Of someone more deserving of the full penalty of law
The way you made them suffer, your exquisite wife and mother
Fills me with the urge to defecate
(Go on, Judge, shit on him!)
Since, my friend, you have revealed your deepest fear
I sentence you to be exposed before your peers
Tear down the wall!

[Outro: Crowd]
Tear down the wall!
Tear down the wall!
Tear down the wall!
Tear down the wall!
Tear down the wall!
Tear down the wall!
Tear down the wall!
Tear down the wall!
Tear down the wall!
Tear down the wall!
Tear down the wall!
Tear down the wall!
Tear down the wall!
Tear down the wall!

*explosion*
*bricks crumbling*",1979,0,Pink Floyd
"[Verse]
All alone, or in twos
The ones who really love you
Walk up and down, outside the wall
Some hand in hand
And some gathered together in bands
The bleeding hearts and the artists make their stand
And when they've given you their all
Some stagger and fall, after all it's not easy
Banging your heart against some mad bugger's wall

[Outro]
Isn't this where...",1979,0,Pink Floyd
"Isn't this where…
…we came in?",1979,0,Pink Floyd
"[Verse 1]
I can think of younger days when living for my life
Was everything a man could want to do
I could never see tomorrow
But I was never told about the sorrows

[Chorus]
And, how can you mend a broken heart?
How can you stop the rain from falling down?
How can you stop the sun from shining?
What makes the world go round?
How can you mend this broken man?
How can a loser ever win?
Please help me mend my broken heart and let me live again

[Verse 2]
I can still feel the breeze that rustles through the trees
And misty memories of days gone by
We could never see tomorrow
No one said a word about the sorrow

[Chorus]
And how can you mend a broken heart?
How can you stop the rain from falling down?
How can you stop the sun from shining?
What makes the world go round?
And how can you mend this broken man?
How can a loser ever win?
Please help me mend my broken heart and let me live again

[Bridge]
La la la la la la, la la la la
La la la la la la, la la la la

[Outro]
Please help me mend my broken heart and let me live again
Da da da da
Da da da da, da da da da da, da",1971,0,Bee Gees
"[Verse 1]
You've had your troubles Israel
I've seen them all
But you put the writing on the wall
Israel, Israel

[Verse 2]
You know I've seen you fall so many times
I've cried for you and that's a crime
Israel, Israel, Israel

[Chorus]
Where there's sand
Where there's beautiful sand
You know you got a kind of feeling
That's just grand
Take me into your arms
Let me be with you
Israel, Israel, Israel

[Verse 3]
I like the smiles up on your people's faces
They make you feel warm embraces
And I want that kind of smile
That kind of smile
Israel you make the whole world think about you
And if they don't they'll find a reason
To shout about Israel, Israel

[Verse 4]
You're the only one, Israel, Israel
Tell me all about it!
Tell me all about it
Tell me all about it
Oh, take me into your arms
And make me feel your goodness
Be with me Israel
Take me into your arms
Let me hold hold you to myself
Oh, I want to, Israel

[Outro]
Israel, take me back into into your arms
Israel, Israel, Israel, Israel
Israel",1971,0,Bee Gees
"Before I heard your voice
I never heard a sound like that before
I wanna hear it more and more

Take me to heaven
My love is stronger than the wall
I'll climb it till I fall
So I can hear you call, your love

I'd be the greatest man in the world
'Cause I can say I got the greatest girl
I'd be the greatest man in the world
'Cause I can say I got the greatest girl

Before I saw your face
I never saw a dream like that before
I wanna see it more and more

Take me to heaven
My love is stronger than the wall
I'll climb it till I fall
So I can hear you call, your love

Be the greatest man in the world
'Cause I can say I've got the greatest girl
Be the greatest man in the world
'Cause I can say I got the greatest girl
The greatest girl

Be the greatest man in the world
Oh, be the greatest man in the world
Be the greatest man, the greatest man in the world
The greatest man, be the greatest man in the world",1971,0,Bee Gees
"Just the way that I feel about tomorrow
I'll be sad and alone all the time
It's just the way that you said
You don't love me anymore, then goodbye

I can't believe what you're saying
You don't love me anymore, goodbye

Just the way that I feel about tomorrow
Knowing you won't be there by my side
I wish that I could say to you
Well, can't we just be good friends?

Would you leave the door open
Let me walk in again?

That's the way I've been thinking 'bout tomorrow
I only know that friends can't be lovers again",1971,0,Bee Gees
"I never really want to be alone
I had a woman once in my life
But now she's flown
Every night I keep seeing her face

I never really broke her heart
She was a part of me
But that's the way it was
Now we live separately
When will you walk through this door babe?
When you left I fell to pieces but now I feel as good as if I were dead

I'll keep remembering all my life
Remembering when you were my wife
Remembering all my life
And I'm facing a life that I must go through remembering

I first set my eyes on you one cold February
You made me go out of my way to make me feel fine
Oh, but when will you walk through this door babe?
When you left I fell to pieces, now I feel as good, as good as if I were dead

I'll keep remembering all my life
Remembering when you were my wife
Remembering all my life
And I'm facing a life that I must go through remembering",1971,0,Bee Gees
