lyrics,year,lable,name
"[Chorus]
We'll sing in the sunshine
We'll laugh every day
We'll sing in the sunshine
And I'll be on my way

[Verse 1]
I will never love you
The cost of love's too dear
But though I'll never love you
I'll live with you one year

[Chorus]
We'll sing in the sunshine
We'll laugh every day
We'll sing in the sunshine
And I'll be on my way

[Verse 2]
I'll sing to you each morning
I'll kiss you every night
But darling, don't cling to me
I'll soon be out of sight

[Chorus]
We'll sing in the sunshine
We'll laugh every day
We'll sing in the sunshine
And I'll be on my way

[Verse 3]
My daddy he once told me
Hey, don't you love you any man
Just take what they can give you
And give but what you can

[Chorus]
We'll sing in the sunshine
We'll laugh every day
We'll sing in the sunshine
And I'll be on my way

[Verse 4]
And when our year has ended
And I have gone away
I'll often speak about you
And this is what I'll say

[Verse 5]
You know we sang in the sunshine
We laughed every day
We sang in the sunshine
Then I went on my way",1984,0,Dolly Parton
"[Verse 1]
Oh sugar pie, honey bunch
You know that I love you
I can't help myself
I love you and nobody else

[Verse 2]
In and out my life
You come and you go
Leaving just your picture behind
And I've kissed it a thousand times

[Verse 3]
When you snap your fingers or wink your eye
I come a running to you
Tied to you like a ball-and-chain
And there's nothing that I can do

Can't help myself
No, I can't help myself

[Verse 4]
Sugar pie, honey bunch
I'm weaker than a girl should be
I can't help myself
I'm a fool in love you see

[Verse 5]
I wanna tell you I don't love you
Tell you that we're through
And I've tried
But every time I see your face
I get all choked up inside

[Verse 6]
When I call your name
Boy it starts the flame
Burning in my heart
Tearing it all apart
No matter how I try
My love I cannot hide

[Verse 7]
Sugar pie, honey bunch
You now that I'm weak for you
I can't help myself
I love you and nobody else

[Verse 8]
Ooh sugar pie honey bunch
I'll do anything you ask me to
I can't help myself
I want you and nobody else

[Verse 9]
Sugar pie, honey bunch
You know that I love you
I can't help myself
No no no, I can't help myself",1984,0,Dolly Parton
"[Verse 1]
You might wake up some morning
To the sound of something moving past your window in the wind
And if you're quick enough to rise
You'll catch the fleeting glimpse of someone's fading shadow
Out on the new horizon
You may see the floating motion of a distant pair of wings
And if the sleep has left your ears
You might hear footsteps running through an open meadow

[Chorus]
Don't be concerned, it will not harm you
It's only me pursuing something I'm not sure of
Across my dreams, with nets of wonder
I chase the bright elusive butterfly of love

[Verse 2]
You might have heard my footsteps
Echo softly in the distance through the canyons of your mind
I might have even called your name
As I ran searching after something to believe in
You might have seen me running
Through the long abandoned ruins of the dreams you left behind
If you remember something there
That glided past you followed close by heavy breathing

[Chorus]
Don't be concerned, it will not harm you
It's only me pursuing something I'm not sure of
Across my dreams, with nets of wonder
I chase the bright elusive butterfly of love

[Verse 3]
Across my dreams, with nets of wonder
I chase the bright elusive butterfly of love
Across my dreams, with nets of wonder
I chase the bright elusive butterfly of love",1984,0,Dolly Parton
"[Verse 1]
Oh-oh, yes I'm the great pretender
Pretending that I'm doing well
My need is such I pretend too much
I'm lonely but no one can tell

[Verse 2]
Oh-oh, yes I'm the great pretender
Adrift in a world of my own
I've played the game but to my real shame
You've left me to dream all alone

[Chorus]
Too real is this feeling of make-believe
Too real when I feel what my heart can't conceal

[Verse 3]
Oh yes I'm the great pretender
Just laughing and gay like a clown
I seem to be what I'm not, you see
I'm wearing my heart like a crown
Pretending that you're still around

[Chorus]
Too real is this feeling of make-believe
Too real when I feel what my heart can't conceal

[Verse 4]
Oh yes I'm the great pretender
Just laughing and gay like a clown
I seem to be what I'm not, you see
I'm wearing this old heart like a crown
Pretending that you're still around

[Outro]
But I know what I am
I am the great pretender",1984,0,Dolly Parton
"[Verse 1]
I wish you flowers, sunshine and smiles
I wish you children that grow to make you proud
I wish you pretty things to wear
Sweet things to smell

[Chorus]
I wish you well (I wish you well)
I wish you well (I wish you well)
I wish you well (I wish you well)
I wish you well (Well)

[Verse 2]
I wish you good friends that always treat you fair
Wanna wish you ribbons to tie around your hair
I wish you truckloads of cheer and many happy years

[Chorus]
I wish you well (I wish you well)
I wish you well (I wish you well)
I wish you well (I wish you well)
I wish you well (Well)

[Verse 3]
Wanna wish you freedom to do all the things you love
I wish you blessings and kindness from above
Wanna wish you sunlight through the clouds
Hope you laugh out loud

[Chorus]
I wish you well (I wish you well)
I wish you well (I wish you well)
I wish you well (I wish you well)
I wish you well (Well)

[Outro]
I wish you well (I wish you well)
I wish you well (I wish you well)
I wish you well (I wish you well)
I wish you well (Well)
Oh now, I wish you well (I wish you well)
I wish you well (I wish you well)
I wish you well (I wish you well)
I wish you well (Well)
Oh now, I wish you well (I wish you well)
I wish you well (I wish you well)
I wish you well (I wish you well)
I wish you well (Well)",1975,0,Bill Withers
"[Verse 1]
Looking at what I see
What does living mean to me
All that I can ever be is just a man

[Chorus]
And the most you can ever do is the best you can

[Verse 2]
Riding on the world go round
Being me and a what I am
And what I am, I'm just a man

[Chorus]
And the most you can ever do is the best you can

[Bridge]
And what I've found is mostly worth it all
The wisdom of the future is the past
In city brouges and wise old southern drawls
The words that say the most say things that last

[Verse 3]
Riding on the world go round
Being me and what I am
And what I am, I'm just a man

[Chorus]
And the most you can ever do is the best you can
And the most you can ever do is the best you can
And the most you can ever do is the best you can",1975,0,Bill Withers
"[Verse 1]
I love the story in your love song
Building them castles in your mind
You come down here looking for a feeling
Someday I know you're gonna find
I wanna lay down now beside you
But first we ought to take some time

[Chorus]
Before I make love to your body
I wanna make love to your mind

[Verse 2]
I wanna feel good just like you do (Feel good)
I haven't loved in quite some time (Feel good)
I have some phases that I've been through
Where I've just loved and left behind
I'm just too tired of feeling guilty
I don't wanna be unkind

[Chorus]
But before I make love to your body
I wanna make love to your mind
I wanna make love to your mind
I wanna make love to your mind
Before I make love to your body
I wanna make love to your mind

[Verse 3]
I wanna feel good just like you do (Feel good)
I haven't loved in quite some time (Feel good)
Know I had some funny phases that I've been through
Where I've just loved and left behind
I'm just too tired of feeling guilty
I don't really wanna be unkind

[Chorus]
But before I make love to your body
I wanna make love to your mind (To your mind)

[Bridge]
To your mind
To your mind
To your mind
To your mind

[Verse 4]
I love the story in your love song, little girl
Building them castles in your mind, mmm
You come down here from somewhere looking for a feeling
Someday I know you're gonna find
See, I wanna lay down now beside you, oh oh (Lay down)
But first we ought to take some time (Time)

[Chorus]
But before I make love to your body
I wanna make love to your mind

[Outro]
(To your mind)
I wanna make love to your mind (To your mind)
I wanna make love to your mind (To your mind)
I wanna make love to your mind
To your mind, ooh yeah
To your mind
To your mind",1975,0,Bill Withers
"[Verse]
And I've sat in the sunshine in summers of sadness
And lived through the winter when lonely was here
And I've gone through the motions of feeling for fear
That I never would find you, my dear
And I'm thankful to whoever made it all possible
For me to be with you while I lived
And spare you the grief if I passed on before you
And I don't think I'd live if you died before me
And I hope that the smell of these roses will follow you
On in the time when the roses are gone

[Outro]
I love you, Dawn
I love you, Dawn",1975,0,Bill Withers
"She's a different kinda lady
She's not often understood
She's a doin' kinda lady

And what she's doin' does some good

But she lonely
But she lonely
She lonely
But she lonely

Free and easy kinda lady
And the books she reads are good
Let me be me kinda lady
And she's being what she should

But she lonely (lonely)
She lonely (lonely)
Pretty little girl is lonely (lonely)
She lonely (lonely)

Yeah, pretty little girl is lonely (lonely)
It's a well kept secret (lonely)
Pretty little girl is lonely (lonely)
Pretty little girl is lonely (lonely)

She's a different kinda lady
She's not often understood
She's a doin' kinda lady
And all the things she's doin' does some good

Ah but she lonely, hey hold on (lonely)
That pretty little girl is lonely (lonely)
Ah it's a well kept secret (lonely)
That the pretty little girl is lonely (lonely)

She, I know, she lonely (lonely)
That pretty little girl is lonely, yeah (lonely)
It's one of the well kept secrets in the world, hold on (lonely)
That pretty little girl is lonely, yeah (lonely)
Yeah, that pretty little girl is lonely, hold on (lonely)
That's she kinda lonely (lonely)
That pretty little girl is lonely (lonely)
That pretty little girl is lonely (lonely)

Free and easy kinda lady
And the books she reads are good
Let me be me kind of lady
And she's being what she should

Oh but she lone, hold on, wow (lonely)
You know the pretty little girl is lonely (lonely)
It's a well kept secret, oh well (lonely)
That the girl is lonely (lonely)
And go together lonely (lonely)
Some flashy lonely, hold on (lonely)

Might be lonely for David, hold on (lonely)
Might be lonely for Larry (lonely)
Might be lonely for Dennis, hold on (lonely)
Might be lonely for George, ah ha ha (lonely)
My dear girl lonely for Lewis, ah ha (lonely)
Might be lonely for Harvey (lonely)

Ah but pretty little girl is lonely (lonely)
Say the pretty little girl is lonely, well (lonely)
(lonely)
Well (lonely)
Well (lonely)
Well (lonely)
Pretty little girl is lonely (lonely)
Well she's sendin' ..., oh (lonely)
Oh pretty little girl is lonely, how (lonely)",1975,0,Bill Withers
"[Verse 1]
Sometimes a song is funky
'Cause you feel that way
A song might be easy and melancholy on another day
Sometimes a song gets mean and evil 'cause it ain't goin' right
Sometimes a song just try to get nervous 'cause you might be uptight
Sometimes a song is tender
Sometimes a song is sad
Maybe that evening that you wrote this song that's all the feeling you had
Sometimes a song just feels real good and lays right there in the groove
Sometimes a song might make you just wanna get up and move
Sometimes a song is somethin', uh-huh, that you never forget
But you keep on thinking that you ain't wrote the song yet

[Chorus]
Ah, sometimes a song, sometimes a song
Sometimes a song, sometimes a song

[Verse 2]
Sometimes a song is funky (Song is funky)
'Cause you feel that way ('Cause you feel that way)
A song might be easy and melancholy on another day
Sometimes a song gets mean and evil 'cause it ain't goin' right
('Cause it ain't goin' right)
Sometimes a song just try to get nervous 'cause you might be uptight
Sometimes a song is tender (Tender, tender)
Sometimes a song is sad (Song is sad)
Maybe that evening that you wrote this song that's all the feeling you had
Sometimes a song just feels real good and lays right there in the groove
(Right there in the groove)
Sometimes a song might make you just wanna get up and move
(Get up and groove)
Sometimes a song is somethin', uh-huh, that you never forget
But you keep on thinking that you ain't wrote the song yet

[Chorus]
Ah, sometimes a song, sometimes a song
Sometimes a song, sometimes a song",1975,0,Bill Withers
"[Verse 1]
I will lay around sometimes and show some sadness
For people whom I've known that now are gone
And I will smile to show you when I'm happy
And let you know when things are going wrong
I will try my best to be there when you need me
And give you strength when you need someone strong
And I'll sit and cry with you, my dear, if need be
And I'll paint your pretty picture with a song

[Chorus]
I will paint your pretty picture with a song
I will paint your pretty picture with a song
Tell you tales of life as I see it
And I'll paint your pretty picture with a song

[Verse 2]
I will try my best to be there when you need me
To give you strength when you need someone strong
And I'll sit and cry with you, my dear, if need be
And I'll paint your pretty picture with a song

[Chorus]
I will paint your pretty picture with a song
I will paint your pretty picture with a song
I'll tell you tales of life as I see it
And I'll paint your pretty picture with a song

[Outro]
I will paint your pretty picture with a song
I will paint your pretty picture with a song
Tell you tales of life as I see it
And I'll paint your pretty picture with a song",1975,0,Bill Withers
"I will follow my dreams wherever
They take me
I will stand upon the mountain and look down upon the seashores
But I'll always remember
The family table
If I don't ever go there anymore
I will stand up when it seems
That my troubles might break me
I will listen even though I know I've
Heard it all before
But I'll always remember
The family table
If I don't ever go there anymore",1975,0,Bill Withers
"[Verse 1]
Busy hanging curtains
Children in the way
Whoa, that's what the future holds with me
Don't you want to stay?

Better talk to Billy
His doggy died today
Whoa, that's what the future holds with me
Don't you want to stay?

[Chorus]
Don't you want to stay?
Whoa, don't you want to stay?
That's what the future holds with me
Don't you want to stay?

[Verse 2]
Sundays in the meadow
See the children play
Whoa, that's what the future holds with me
Don't you want to stay?

[Chorus]
Don't you want to stay?
Whoa, don't you want to stay?
That's what the future holds with me
Don't you want to stay?

[Outro]
Don't you wanna stay?
Don't you wanna stay?
Don't you wanna stay?",1975,0,Bill Withers
"[Verse]
Hello like before
I'd never come here
If I'd known that you were here
I must admit though
That's it's nice to see you, dear
You look like you've been doing well

Hello like before
I hope we've grown
'Cause we were only children then
For laughs I guess we both can say
'I knew you when'
But then again, that's kiss and tell

Hello like before
I guess it's different
'Cause we know each other now
I guess I've always known
We'd meet again somehow
So then it might as well be now

[Instrumental break]

[Outro]
Hello like before
I hope we've grown
'Cause we were only children then
For laughs I guess we both can say
'I knew you when'
But then again, that's kiss and tell

Hello like before
I guess it's different
'Cause we know each other now
I guess I've always known
We'd meet again somehow
So then it might as well be now",1975,0,Bill Withers
"*Crowd cheering*
*Eminem humming to himself*
*Checking mic*

We still on?
*Machinery starting*
Yo, is the mic on?
Check, check, check, aight, it's good, let's go, come on

*Machinery working*
*Cheering intensifies*
(Eminem, Eminem, Eminem!
Eminem, Eminem, Eminem!
Eminem, Eminem, Eminem!
Eminem, Eminem, Eminem!)",2004,1,Eminem
"[Intro]
Lord, please forgive me for what I do
For I know not what I've done

[Hook]
Father, please forgive me for I know not what I do
I just never had the chance to ever meet you
Therefore I did not know that I would grow to be
My mother's evil seed and do these evil deeds

[Verse 1]
Momma had a baby and its head popped off
Head popped off, head popped off, head popped off, head popped off, head popped off
But Momma don't want me, the next thing I know, I'm gettin' dropped off
Gettin' dropped off, gettin' dropped off, gettin' dropped off, gettin' dropped off
Ring-ring-ring on the doorbell of the next door neighbors, on their front porch
Their front porch, their front porch, their front porch, their front porch
But they didn't want me neither, so they left me on someone else's lawn
Else's lawn, else's lawn, else's lawn
'Til somebody finally took me in, my great aunt and uncle, Edna and Charles
Edna and Charles, Edna and Charles, Edna and Charles, Edna and Charles, they were the ones who were left in charge
My elementary, they'd gang up on me and sing this song
Sing this song, sing this song, sing this song, sing this song
It went a little something like
""Mary had a little lamb, little lamb, little lamb
Debbie had a Satan spawn, Satan spawn""
Momma why do they keep sayin' this? I just don't understand, understand
And by the way, where's my dad?

[Hook]
Father, please forgive me for I know not what I do
I just never had the chance to ever meet you
Therefore I did not know that I would grow to be
My mother's evil seed and do these evil deeds

[Verse 2]
Predominantly, predominantly, everything's always predominantly
Predominantly-white, predominantly black. Well, what about me?
Where does that leave me? Well, I guess that I'm between predominantly both of 'em
I think if I hear that fuckin' word again, I'ma scream
While I'm projectile vomitin'; what do I look like, a comedian to you?
Do you think that I'm kiddin'? What do I look like, some kinda idi...
Wait a minute, shit, don't answer that; why am I so misunderstood?
Why do I go through so much bullshit? It's such bullshit, it's tush mull bish
""Woe is me, there goes poor Marshall again whinin' about his millions
And his mansion and his sorrow he's always drownin' in
And the dad that he never had, and how his childhood was so bad
And how his mom was a dope addict, and his ex-wife, how they go at it
Man, I'd hate to have it as bad as that Mr. Mathers claims he had it
I can't imagine it. That little rich, poor, white bastard
Needs to take some of that cash out of the bank and take a bath in it
Man, if I only had half of it""
Shit, if you only knew the half of it...
Haha

[Hook]
Father, please forgive me for I know not what I do
I just never had the chance to ever meet you
Therefore I did not know that I would grow to be
My mother's evil seed and do these evil deeds

[Verse 3]
Evil deeds, while I plant these evil seeds
Please release me from these demons
I never had any of this shit planned, Mom, please believe
I don't wanna be Satan's spawn
Never got the chance to say I'm sorry
Now look at all the pain I caused
Dear Santa Claus, why are you not comin' this year again?
What did I do that was so bad to deserve this?
Everything could have been so perfect
But life ain't a fairytale. I'm about to be hoisted up in the air
Forty feet below me there's people everywhere
I don't even know but who feel like they know me 'cause I'm in this ferris wheel
And all I wanna do is go to the mall and take Hailie on the carousel
Without this crowd everywhere I go, but life is like a merry-go-round
Here we go now, do-si-do now, curtains up, the show must go now
Ring-around-the-rosie, the show's over, you can all go home now
But the curtain just don't close for me, this ain't how fame was supposed to be
Where's the switch I could just turn off-and-on? This ain't what I chose to be
So please, God, give me the strength to have what it takes to carry on
'Til I pass 50 back the baton, the camera's on, my soul is gone

[Hook]
Father, please forgive me for I know not what I do
I just never had the chance to ever meet you
Therefore I did not know that I would grow to be
My mother's evil seed and do these evil deeds
I said, Father, please forgive me for I know not what I do
I just never had the chance to ever meet you
Therefore I did not know that I would grow to be
My mother's evil seed and do these evil deeds
(Evil deeds, evil deeds, evil deeds)

[Outro]
[Gunshot]
[Crowd cheering]
Oh!
Last one, baby, let's go
Last one, baby, let's go
Detroit!",2004,1,Eminem
"[Verse 1: Eminem]
There's not much you could do or say to phase me
People think I'm a little bit crazy
I get it from all angles, even occasionally Doc Dre-zie
Will have to step in every once in a while to save me
To make me stop and think about it 'fore I just say things
Sometimes I forget what other people just may think
A lot of rappers probably wouldn't know how to take me
If they heard some shit, I'd lay the tape 'fore they erased me
I may be a little too fast-paced and racy
Sometimes the average listener rewinds and plays me
Twenty times 'cause I say so many rhymes it may seem
Like I'm goin' too fast 'cause my mind is racing
And I could give a fuck what category you place me
Long as when I'm pushing up daisies
And gone as long as you place me amongst one of them greats
When I hit the heavenly gates I'll be cool beside Jay-Z
For every single die-hard fan who embraced me
I'm thankful for the talent in which God gave me
And I'm thankful for the environment that he placed me
Believe it or not, I thank my mom for how she raised me
In the neighborhood daily that jumped and chased me
It only made me what I am today, see
Regardless of what anybody believes who hates me
You ain't gonna make or break me
Tryna strip me of my credibility and make me look fake, G
You're only gonna be in for a rude awakening
'Cause sooner or later you haters are all gonna face me
And when you face me with all the shit you've been saving
To say to me, you had all this time to think about it
Now don't pussy out and try to about face me
'Cause I've been patiently waiting for the day
That we finally meet in the same place to see

[Hook: Nate Dogg]
No matter how many battles I been in and won
No matter how many magazines on my nuts
No matter how many emcees I eat up
Oh, it's never enough
No matter how many battles I been in and won
No matter how many magazines on my nuts
No matter how many emcees I eat up
Oh oh, it's never enough

[Verse 2: 50 Cent]
My flow's untouchable, now you gotta face it
Uh oh, it gets worse when I go back to the basics
You gon' say the wrong shit and get your whole face split
The smell of victory, love it so much I can taste it
I spot my target, blaze it, direct hit
Graze it, your peace talk, save it
Your shit sounds dated, you're overrated
I'm obligated to study your moves then crush you motherfuckers
If I'm the best and the worst, then God's gift is a curse
Soldier trained to destroy – you payin' attention, boy?
I spit shit, slick shit, so quick you miss it
To be specific I go ballistic as hieroglyphic
My music is a drug, press play, you ain't gotta sniff it
Shoot it or pop it, roll it, bag it or chop it
It'll get you high over and over, but you gotta cop it
When it's hot, it's hot, your hatin' is undeniable, stop it

[Hook: Nate Dogg]
No matter how many battles I been in and won
No matter how many magazines on my nuts
No matter how many emcees I eat up
Oh, it's never enough
No matter how many battles I been in and won
No matter how many magazines on my nuts
No matter how many emcees I eat up
Oh oh, it's never enough",2004,1,Eminem
